{
  "schema_version": "plx-unified-knowledge-program/v1",
  "program_id": "PRJ-UNIFIED-KNOWLEDGE",
  "title": "Unified PLX Document and Knowledge Architecture",
  "source_task": "TASK-477",
  "accountable_owner": "vince@petrasoap.com",
  "architecture_pattern": "Knowledge Ledger with Disposable Projections",
  "status": "approved-spec",
  "authority_matrix": [
    {
      "system": "SharePoint and Microsoft 365",
      "authority": "canonical",
      "canonical_for": [
        "business-owned operational records",
        "controlled documents",
        "retention labels and records declarations"
      ],
      "projection_policy": "Ingest identifiers, metadata, permissions, version references, and extracts; never silently replace the source file.",
      "authoring_return_path": "Open the authoritative SharePoint or Microsoft 365 item.",
      "owner": "department head for the owning business domain"
    },
    {
      "system": "Git repositories",
      "authority": "canonical",
      "canonical_for": [
        "technical documentation",
        "SOPs and runbooks governed in code",
        "tools and skills"
      ],
      "projection_policy": "Index immutable commit references and derived chunks; rebuild projections from Git.",
      "authoring_return_path": "Open a pull request in the owning repository.",
      "owner": "repository owner"
    },
    {
      "system": "PLX Customer Portal gold tables",
      "authority": "workflow-authority",
      "canonical_for": [
        "customer workflow state",
        "product and formulation workflow records",
        "vendor workflow state"
      ],
      "projection_policy": "Project approved workflow facts and links, not mutable copies of gold records.",
      "authoring_return_path": "Open the authoritative Portal workflow.",
      "owner": "Portal domain owner"
    },
    {
      "system": "Mission Control",
      "authority": "execution-authority",
      "canonical_for": [
        "projects",
        "buckets",
        "tasks",
        "milestones",
        "risks",
        "delivery evidence"
      ],
      "projection_policy": "All implementation activity resolves to a Task and evidence remains attributable.",
      "authoring_return_path": "Open the Mission Control task or project.",
      "owner": "vince@petrasoap.com"
    },
    {
      "system": "Knowledge Ledger",
      "authority": "canonical",
      "canonical_for": [
        "versioned knowledge assertions",
        "provenance relationships",
        "ontology versions",
        "ingestion receipts"
      ],
      "projection_policy": "Append or supersede assertions bitemporally; never treat search indexes as ledger truth.",
      "authoring_return_path": "Open the cited source and submit a governed assertion or ontology change.",
      "owner": "vince@petrasoap.com"
    },
    {
      "system": "PLX Second-Brain",
      "authority": "derived",
      "canonical_for": [
        "derived memory",
        "confidence-weighted relationships",
        "retrieval context"
      ],
      "projection_policy": "Disposable consumer of ledger and canonical-source events; outage cannot block canonical reads.",
      "authoring_return_path": "Return to the cited canonical source or ledger assertion.",
      "owner": "Second-Brain service owner"
    },
    {
      "system": "Agent Registry",
      "authority": "registry-authority",
      "canonical_for": [
        "agent identity",
        "approved capabilities",
        "human accountability binding",
        "revocation state"
      ],
      "projection_policy": "Expose reviewed identities and capability versions to policy enforcement.",
      "authoring_return_path": "Use the governed Agent Registry approval flow.",
      "owner": "vince@petrasoap.com"
    },
    {
      "system": "MCPs, tools, and skills",
      "authority": "registry-authority",
      "canonical_for": [
        "tool contracts",
        "skill packages",
        "runtime integration metadata"
      ],
      "projection_policy": "Pin immutable versions and audit invocation; no unregistered autonomous action.",
      "authoring_return_path": "Change the canonical registry or source repository.",
      "owner": "integration owner"
    },
    {
      "system": "DocuSign",
      "authority": "canonical",
      "canonical_for": [
        "envelope execution evidence",
        "signature certificates",
        "signer and routing evidence"
      ],
      "projection_policy": "Store envelope identifiers, status, hashes, and links; preserve signed artifacts under approved retention controls.",
      "authoring_return_path": "Open the authoritative DocuSign envelope or controlled archive.",
      "owner": "Quality and Legal"
    },
    {
      "system": "Portal ontology workbench",
      "authority": "workflow-authority",
      "canonical_for": [
        "ontology change proposals",
        "review decisions",
        "impact previews",
        "publication approvals"
      ],
      "projection_policy": "Draft changes in branches; publish immutable ontology versions to the ledger only after approval.",
      "authoring_return_path": "Open the ontology proposal and approval history.",
      "owner": "department ontology steward"
    },
    {
      "system": "Graph, vector, and full-text indexes",
      "authority": "derived",
      "canonical_for": [
        "none"
      ],
      "projection_policy": "Disposable, version-stamped, security-trimmed projections rebuilt from the ledger and canonical-source connectors.",
      "authoring_return_path": "Return to the ledger assertion and canonical source.",
      "owner": "knowledge platform operator"
    }
  ],
  "invariants": [
    {
      "id": "INV-01",
      "statement": "Knowledge Ledger with Disposable Projections is the governing architecture pattern.",
      "enforced_by": [
        "program schema constant",
        "validator required invariant"
      ]
    },
    {
      "id": "INV-02",
      "statement": "Every surfaced fact identifies its canonical source, source revision, ingestion receipt, and derivation path.",
      "enforced_by": [
        "ledger assertion contract",
        "provenance completeness gate"
      ]
    },
    {
      "id": "INV-03",
      "statement": "Graph, vector, text, cache, and Second-Brain surfaces are rebuildable and never become sole authority.",
      "enforced_by": [
        "projection rebuild drill",
        "authority matrix"
      ]
    },
    {
      "id": "INV-04",
      "statement": "Ontology changes are versioned, previewed, reviewed, reversible, and attributable.",
      "enforced_by": [
        "ontology workbench publication gate",
        "immutable ontology version"
      ]
    },
    {
      "id": "INV-05",
      "statement": "Department heads remain accountable while teams and agents retain bounded autonomy.",
      "enforced_by": [
        "human owner on every milestone, risk, gate, and task",
        "Agent Registry capability policy"
      ]
    },
    {
      "id": "INV-06",
      "statement": "Every implementation action resolves to a Mission Control task with evidence and rollback.",
      "enforced_by": [
        "Mission Control checkout",
        "completion evidence gate"
      ]
    },
    {
      "id": "INV-07",
      "statement": "Authorization is deny by default and search results are security trimmed before ranking or generation.",
      "enforced_by": [
        "central authorization policy",
        "retrieval authorization tests"
      ]
    },
    {
      "id": "INV-08",
      "statement": "Retention, disposition, legal hold, privacy, and residency remain source-aware and policy controlled.",
      "enforced_by": [
        "records schedule gate",
        "data-flow inventory"
      ]
    },
    {
      "id": "INV-09",
      "statement": "Part 11 controls apply only after Quality and Legal approve intended use and the validated-system boundary.",
      "enforced_by": [
        "Phase 0 intended-use gate",
        "validation plan"
      ]
    },
    {
      "id": "INV-10",
      "statement": "Duplicate, contradiction, and staleness signals never silently delete or overwrite canonical content.",
      "enforced_by": [
        "human resolution queues",
        "non-destructive detectors"
      ]
    },
    {
      "id": "INV-11",
      "statement": "Every answer or recommendation exposes source links, revision time, confidence, and known conflicts.",
      "enforced_by": [
        "explainability acceptance tests",
        "answer citation contract"
      ]
    },
    {
      "id": "INV-12",
      "statement": "Milestones, dependencies, risks, gates, and validation are machine readable and fail closed on drift.",
      "enforced_by": [
        "program JSON Schema",
        "deterministic program validator"
      ]
    }
  ],
  "phase_zero_gates": [
    {
      "id": "P0G-01",
      "title": "Microsoft 365 estate and licensing inventory",
      "owner": "vince@petrasoap.com",
      "status": "blocked",
      "done_when": [
        "Live-environment tenants, sites, libraries, Purview capabilities, license entitlements, regions, and administrators are recorded.",
        "Graph permissions and least-privilege connector identities are approved."
      ],
      "blocks": [
        "MS-02",
        "MS-04",
        "MS-06"
      ]
    },
    {
      "id": "P0G-02",
      "title": "Portal and Second-Brain repository and runtime inventory",
      "owner": "vince@petrasoap.com",
      "status": "blocked",
      "done_when": [
        "The authoritative Portal document stack and Second-Brain implementation are accessible and reviewed.",
        "Existing schemas, ownership, APIs, and deployment boundaries are recorded without inference."
      ],
      "blocks": [
        "MS-01",
        "MS-03",
        "MS-05"
      ]
    },
    {
      "id": "P0G-03",
      "title": "Part 11 intended-use and validated-system boundary",
      "owner": "vince@petrasoap.com",